{
  "schema": "KC144.ProductionEvidenceRelease.V7",
  "release": "KC144.PRODUCTION.EVIDENCE.KERNEL.V7",
  "parent_release": "KC144.M12.REPAIR.COMPILER.V6",
  "verdict": "PASS",
  "operational_status": "READY_AWAITING_PINNED_EXTERNAL_AUTHORITY",
  "m12_status": "HOLD",
  "production_certificate_issued": false,
  "frozen_crystal_mutated": false,
  "added_artifacts": [
    "active_epoch_crosswalk_v7.json",
    "authority_registry_v7.json",
    "graph_slice_registry_v7.json",
    "production_evidence_contract_v7.json",
    "production_evidence_state_v7.json"
  ],
  "next_seed": "KC144.V7::PIN-EXTERNAL-AUTHORITY-AND-SIGN-PARALLEL-WAVE",
  "release_digest": "sha256:398a53b4450812ef6759e0be4e5d6ea62a9cedd9a0975c75c6a0b83f9fe9ba83"
}
